{
  "$schema": "./profile.schema.json",
  "profile": {
    "name": "Afrizal Munthe",
    "username": "Niumination",
    "headline": "Pranata Komputer, Diskominfo Aceh Tengah",
    "affiliation": "Diskominfo Aceh Tengah",
    "location": "Aceh Tengah, Indonesia",
    "status": "Building SPBE & AI Agent Ecosystem",
    "about": [
      "Saya Afrizal Munthe (Niumination) — Pranata Komputer di Diskominfo Aceh Tengah. Fokus pada transformasi digital pemerintahan melalui Sistem Pemerintahan Berbasis Elektronik (SPBE) dan pengembangan ekosistem AI Agent untuk layanan publik.",
      "Ekosistem saya mencakup 40 repositori — maturity-based pipeline: sandbox → labs → services/sites/desktop/agents → apps → archive. Lihat dashboard interaktif: niumination.github.io/ecosystem-config"
    ]
  },
  "focus": [
    {
      "name": "SPBE & GovTech",
      "description": "Sistem Pemerintahan Berbasis Elektronik — portal OPD, KMS, LKH, interoperabilitas layanan publik Aceh Tengah"
    },
    {
      "name": "AI Agent Ecosystem",
      "description": "Multi-agent orchestration, Hermes Agent, dan autonomous workflow untuk otomatisasi tugas pemerintahan"
    },
    {
      "name": "Fullstack Web",
      "description": "Next.js, React, Three.js, Prisma, TanStack Query — dashboard real-time, portal statis, dan aplikasi hybrid"
    },
    {
      "name": "Desktop & Mobile",
      "description": "Tauri 2 (Rust/React), PyQt5 (ADB tooling), Kotlin/Jetpack Compose (AI File Organizer) — aplikasi native yang interoperable"
    }
  ],
  "projects": [
    {
      "name": "PemdiAcehTengah",
      "url": "https://github.com/Niumination/PemdiAcehTengah",
      "homepage": "https://pemdi-aceh-tengah.vercel.app",
      "focus": "Kokpit Pemdi & Dasbor Transparansi",
      "summary": "Reposisi Opsi B (20 Sep 2026): Kokpit Pemdi internal (kelola 250 butir bukti dukung) + dasbor transparansi publik + komponen terintegrasi ke Alpukat Gayo. Next.js 14 + React 18 + pure CSS.",
      "heroLabel": "Flagship GovTech"
    },
    {
      "name": "niu-dash",
      "url": "https://github.com/Niumination/niu-dash",
      "homepage": "https://niumination.github.io/niu-dash",
      "focus": "Ecosystem Dashboard",
      "summary": "Dark web glitch dashboard — 32 proyek tracked (ekosistem 43 git repos). Niumination project inventory & DEV TRACKER. Vanilla JS, v2.16.8.",
      "heroLabel": "Ecosystem Hub"
    },
    {
      "name": "Flame-ADE",
      "url": "https://github.com/Niumination/Flame-ADE",
      "homepage": "",
      "focus": "AI Desktop Environment",
      "summary": "AI-native terminal emulator (ADE) — Tauri 2 + Rust + React 19. macOS Tahoe 26.5, BYOK AI, no telemetry.",
      "heroLabel": "AI Desktop"
    },
    {
      "name": "Niu-LKH",
      "url": "https://github.com/Niumination/Niu-LKH",
      "homepage": "https://niumination.github.io/Niu-LKH",
      "focus": "Laporan Keuangan Hijau",
      "summary": "LKH v3.1.1 — React 19, Vite 6, Tailwind v4, Supabase. 100% Done 🎉. GH Pages live.",
      "heroLabel": "Green Finance"
    },
    {
      "name": "didong-code",
      "url": "https://github.com/Niumination/didong-code",
      "homepage": "",
      "focus": "Agentic Dev Environment",
      "summary": "Didong-Code — Agentic Development Environment dengan jiwa tradisi Gayo Aceh. Electron + React + TypeScript.",
      "heroLabel": "Gayo ADE"
    },
    {
      "name": "kune-ya.com",
      "url": "https://github.com/Niumination/kune-ya.com",
      "homepage": "https://kune-ya.com",
      "focus": "AI Chat RAG",
      "summary": "AI Chat dengan Retrieval-Augmented Generation. Deployed di Vercel. React + TypeScript.",
      "heroLabel": "AI Chat"
    },
    {
      "name": "niu-dash-fullstack",
      "url": "https://github.com/Niumination/niu-dash-fullstack",
      "homepage": "",
      "focus": "Fullstack Dashboard",
      "summary": "Next.js 16 fullstack dashboard — Prisma 7, Three.js, TanStack Query, next-auth.",
      "heroLabel": "Fullstack App"
    },
    {
      "name": "mac-web-dashboard",
      "url": "https://github.com/Niumination/mac-web-dashboard",
      "homepage": "",
      "focus": "macOS Dashboard",
      "summary": "macOS Dashboard v1.1.0 — 6 tabs, AI Workspace, Hermes+Ollama+Agent Discovery.",
      "heroLabel": "System Dashboard"
    }
  ],
  "techStack": [
    "TypeScript",
    "JavaScript",
    "Python",
    "Rust",
    "Next.js",
    "React",
    "Tailwind CSS",
    "Prisma",
    "PostgreSQL",
    "Supabase",
    "Three.js",
    "Tauri 2",
    "Node.js",
    "Kotlin",
    "Qdrant",
    "Ollama"
  ],
  "activity": {
    "enabled": true,
    "limit": 7
  },
  "appearance": {
    "palette": "ocean"
  },
  "footer": "Membangun ekosistem digital untuk Aceh Tengah — SPBE, AI Agents, dan open-source governance."
}